{"schemaVersion":1,"producedAt":"2026-08-16T17:30:00Z","producer":"test-fixture","provenance":{"source":"mock-adapter"},"mock":true,"taskId":"DEV-000001","workflowId":"DEV-000001-workflow","workflowRunId":"wr-aaaaaaaaaaaaaaaaaaaaaaaa","contractHash":"aaaaaaaaaaaaaaaaaaaaaaaaaaaaaaaaaaaaaaaaaaaaaaaaaaaaaaaaaaaaaaaa","gateEligible":false,"containsMock":true,"artifacts":[{"id":"ev-aaaaaaaaaaaaaaaaaaaaaaaa","nodeId":"verify","capability":"deterministic-verify","artifactKind":"verification","kind":"verification","path":"verify/result.json","sha256":"aaaaaaaaaaaaaaaaaaaaaaaaaaaaaaaaaaaaaaaaaaaaaaaaaaaaaaaaaaaaaaaa","mock":true,"gateEligible":false,"schema":"verification-v1","evidenceRole":"deterministic-acceptance","producedAt":"2026-08-16T17:30:00Z","upstreamNodeIds":["review"],"acceptedBy":[]}]}
